{
  "id": "site.pirates.tide_quay.level_3.prototype",
  "kind": "faction_adventure_site",
  "factionId": "faction.pirates.prototype",
  "archetypeId": "site_archetype.pirates.tide_quay",
  "level": 3,
  "footprint": {"gridStandard":"map_cube_v1","modules":[{"origin":[0,0,0],"size":[3,2,2]}],"containmentRule":"all_geometry_collision_selection_props_and_hooks_inside_module_union","containedBounds":[{"kind":"visual","moduleIndex":0,"normalizedMin":[0,0,0],"normalizedMax":[1,1,1]},{"kind":"collision","moduleIndex":0,"normalizedMin":[0,0,0],"normalizedMax":[1,1,1]},{"kind":"selection","moduleIndex":0,"normalizedMin":[0,0,0],"normalizedMax":[1,1,1]}],"containedElements":[{"id":"spawn.tide_quay.pier","kind":"spawn_point","moduleIndex":0,"normalizedPosition":[0,0,0.5]},{"id":"spawn.tide_quay.market","kind":"spawn_point","moduleIndex":0,"normalizedPosition":[0.5,0,0.5]},{"id":"socket.tide_quay.waterway","kind":"tether_socket","moduleIndex":0,"normalizedPosition":[0,0,0.25]},{"id":"socket.tide_quay.supply","kind":"tether_socket","moduleIndex":0,"normalizedPosition":[1,0,0.25]},{"id":"socket.tide_quay.hidden_route","kind":"tether_socket","moduleIndex":0,"normalizedPosition":[0.5,0,1]},{"id":"influence.tide_quay.smuggler_control","kind":"influence_hook","moduleIndex":0,"normalizedPosition":[0.5,0,0.5]},{"id":"state.tide_quay.construction","kind":"state_hook","moduleIndex":0,"normalizedPosition":[0.25,0,0.25]},{"id":"state.tide_quay.damage","kind":"state_hook","moduleIndex":0,"normalizedPosition":[0.5,0.5,0.5]},{"id":"state.tide_quay.blockade","kind":"state_hook","moduleIndex":0,"normalizedPosition":[0.5,1,0.5]}]},
  "hooks": {
    "actorSpawnPointIds": ["spawn.tide_quay.pier", "spawn.tide_quay.market"],
    "tetherSocketIds": ["socket.tide_quay.waterway", "socket.tide_quay.supply", "socket.tide_quay.hidden_route"],
    "influenceHookIds": ["influence.tide_quay.smuggler_control"],
    "stateHookIds": ["state.tide_quay.construction", "state.tide_quay.damage", "state.tide_quay.blockade"]
  },
  "production": {
    "queueIds": ["production_queue.tide_quay.harbor", "production_queue.tide_quay.market"],
    "spawnRuleIds": ["spawn_rule.tide_quay.deckhands", "spawn_rule.tide_quay.vendors"],
    "rallyPointId": "rally.tide_quay.pier",
    "allowedActorKinds": ["worker", "resident", "vendor", "specialist", "soldier", "named_hero"],
    "dispatchOwner": "faction_ai"
  },
  "generation": {
    "revision": 1,
    "seedInputs": ["world_seed", "faction_id", "structure_instance_id", "archetype_id", "structure_level", "generation_revision"],
    "durableUntil": ["upgrade", "capture", "damage_state_change", "corruption", "declared_refresh"]
  },
  "loot": {
    "factionFamily": "pirate_prize_goods",
    "archetypeFamily": "tide_quay_warehouses",
    "levelBand": 3,
    "higherLevelImprovesExpectedValue": true,
    "distinctiveRewards": ["captured_cargo", "navigation_chart", "smuggler_contact", "boarding_weapon"]
  },
  "metadata": {"implementationOwner": "rust-simulation", "artState": "metadata_only", "animationAllowed": false}
}
